EdemlhJJtxzKq8qBI2od,KPMG,2400,Risk Management and Compliance Initiative,9/30/2023,12/24/2024,"Consulting, Software, RiskManagement, Compliance, StrategyImplementation","Risk Management and Compliance Initiative (KPMG): KPMG is looking for risk management and compliance experts with a background in audit and regulatory compliance. Candidates will be involved in assessing risks, developing compliance frameworks, and implementing strategies to ensure adherence to regulatory standards in various industries."
sGKyYLyYelS4ZFnMR422,WordPress,8000,Website Development and Customization Project,1/30/2023,9/10/2023,"WebDev, WordPress, WebsiteDevelopment, Customization, WebDesign","Website Development and Customization Project (WordPress): WordPress is seeking web developers and designers proficient in website development and customization. Successful candidates will contribute to the creation and customization of websites, ensuring a seamless and user-friendly experience for WordPress users across diverse industries."
xaJrZxp0h3gXxuZ4oj7y,LinkedIn,3200,Professional Networking Platform Enhancement Project,8/3/2023,3/26/2024,"Software, Backend, Database, Networking, ProfessionalNetworking","Professional Networking Platform Enhancement Project (LinkedIn): LinkedIn is seeking candidates with expertise in backend development, database management, and user experience design. Successful candidates will be tasked with enhancing the platform's features, optimizing database performance, and implementing user-friendly interfaces to elevate the professional networking experience for LinkedIn users."
ACr6B81f3WE9zCSiv1AB,Citadel,5600,Algorithmic Trading Strategy Enhancement Project,2/23/2024,6/14/2024,"Statistics, MachineLearning, Python, QuantitativeAnalysis, AlgorithmicTrading","Algorithmic Trading Strategy Enhancement Project (Citadel): Citadel is looking for quantitative analysts and algorithmic trading experts with strong programming skills in languages like Python and experience in financial modeling. The project involves refining algorithmic trading strategies, conducting in-depth market analysis, and implementing enhancements to optimize trading performance and profitability."
HL01hO7KoIItW9x0KmHp,Goldman Sachs,8000,Financial Portfolio Optimization Initiative,7/23/2023,8/22/2023,"Software, DataAnalysis, Finance, PortfolioManagement, InvestmentStrategies","Financial Portfolio Optimization Initiative (Goldman Sachs): Goldman Sachs is seeking candidates with a background in finance, data analytics, and portfolio management. The project focuses on optimizing financial portfolios, leveraging data-driven insights to enhance investment strategies, and ensuring the efficient allocation of assets to maximize returns within the project timeline."
MJNRALv12ZClvZDiajTD,Sig,4000,Quantitative Research and Modeling Challenge,4/4/2024,10/18/2024,"Statistics, MachineLearning, DataAnalysis, QuantitativeResearch, StatisticalModeling","Quantitative Research and Modeling Challenge (Sig): Sig is looking for candidates skilled in quantitative research, statistical modeling, and data analysis. The challenge involves tackling real-world quantitative problems, applying modeling techniques, and presenting innovative solutions to complex financial scenarios."
b3fbJWqYv5xc9xTlhSON,2Sig,2400,Statistical Arbitrage and Market Analysis Project,4/10/2023,10/26/2024,"Statistics, MachineLearning, DataAnalysis, StatisticalArbitrage, TradingPerformance","Statistical Arbitrage and Market Analysis Project (2Sig): 2Sig is in search of candidates with expertise in statistical arbitrage, market analysis, and algorithmic trading. The project entails conducting in-depth statistical analysis of market trends, developing arbitrage strategies, and implementing algorithmic solutions to optimize trading performance."
t26EaFDkGpgU1gvhryX8,Bank of America,6400,Digital Banking User Experience Improvement Project,7/24/2023,12/18/2024,"UIUX, Frontend, UXDesign, DigitalBanking, DesignEnhancements","Digital Banking User Experience Improvement Project (Bank of America): Bank of America is seeking candidates with a background in UX/UI design, digital banking, and customer experience. The project focuses on improving the user experience of digital banking platforms, implementing design enhancements, and ensuring a seamless and intuitive interface for customers."
Tt4XqVzz1jWueP27x4cA,HuggingFace,8800,Natural Language Processing Model Development Project,12/3/2023,6/24/2024,"MachineLearning, NLP, LanguageUnderstanding, TechnologyAdvancement, StateOfTheArt","Natural Language Processing Model Development Project (HuggingFace): HuggingFace is looking for candidates skilled in natural language processing (NLP) and machine learning. The project involves developing and optimizing NLP models, enhancing language understanding capabilities, and contributing to the advancement of state-of-the-art language processing technologies."
mn72JojnKT8Zb4oVa0mM,DataDog,6400,Cloud Infrastructure Monitoring and Optimization Project,1/7/2024,6/14/2024,"Cloud, DevOps, Software, OptimizationStrategies, CloudInfrastructure","Cloud Infrastructure Monitoring and Optimization Project (DataDog): DataDog is seeking candidates with expertise in cloud infrastructure, monitoring tools, and optimization strategies. The project involves implementing and optimizing cloud infrastructure monitoring solutions, ensuring the efficiency and reliability of cloud-based services within the specified project timeline."
DISy7keZ8a9H0mn2J6W2,Nvidia,6400,GPU Accelerated Machine Learning Project,8/31/2023,9/2/2024,"Statistics, MachineLearning, DataAnalysis, GPUAcceleration, ComputingAdvancements",GPU Accelerated Machine Learning Project (Nvidia): Nvidia is looking for candidates with a strong background in embeded computing to optimize quantized models on our cloud computing platform. We will be dealing extnsively with 3D CAD modeling and Simulink testing environment.
bI0ogPVily7OX9g9ezbd,AbbVie,4800,Pharmaceutical Research and Development Initiative,3/17/2024,8/3/2024,"Healthcare, Research, DataAnalysis, PharmaceuticalResearch, DrugDevelopment","Pharmaceutical Research and Development Initiative (AbbVie): AbbVie is seeking candidates with experience in pharmaceutical research, data analysis, and drug development. The initiative involves conducting data anlaysis on OMIC data for ALS and other schlerosis diseases."
ArwBxDOPAPGFy19nn2Hh,Nintendo,5600,Game Development and Innovation Challenge,1/3/2024,2/2/2024,"GameDev, Software, Creativity, GameDevelopment, InnovationChallenge",Game Development and Innovation Challenge (Nintendo): Nintendo is looking for game developers and innovators with creativity and technical skills. The challenge involves designing and developing innovative games for the Nintendo Switch platform. 
O8fjomU38fKIV9nvqRTm,Unity,2400,Augmented Reality Application Development Project,3/13/2024,7/26/2024,"GameDev, Software, ARApplicationDevelopment, 3DModeling, GameDesign","Augmented Reality Application Development Project (Unity): Unity is seeking candidates with experience in augmented reality (AR) application development, 3D modeling, and game design. The project entails developing AR applications in specifically race car simulators."
VI4Sm0B9Qt5BhPJZi7pW,Roblox,4800,Virtual World Creation and Game Design Challenge,10/1/2023,3/9/2024,"GameDev, Software, VirtualWorldCreation, Creativity, Innovation","Virtual World Creation and Game Design Challenge (Roblox): Roblox is looking for game developers and designers to participate in a challenge focused on virtual world creation. Candidates will be tasked with designing innovative virtual environments, developing engaging gameplay mechanics, and contributing to the creativity and diversity of the Roblox gaming platform."
1x639bsEk4MnTkfKsPZ0,American Airlines,2400,Airline Operations Optimization Initiative,6/21/2024,7/31/2024,"Software, DevOps, AirlineOperations, OptimizationStrategies, EfficiencyImprovements","Airline Operations Optimization Initiative (American Airlines): American Airlines is seeking candidates with expertise in airline operations, logistics, and optimization strategies. The initiative involves analyzing operational processes through a mathematical and computational lense, identifying efficiency improvements while maintaing safety of passengers, and running small-scale implementations of these strategies to optimize the overall performance of American Airlines' operations."
R5J1pf481csOhsXbZoWB,Delta Airlines,3200,Passenger Experience Enhancement Project,4/18/2024,6/14/2024,"UIUX, Frontend, CustomerExperience, PassengerJourney, ProcessOptimization","Passenger Experience Enhancement Project (Delta Airlines): Delta Airlines is looking for candidates with skills in customer experience, UX/UI design, and process optimization. The project focuses on enhancing the passenger experience, implementing improvements in services, and ensuring a seamless journey for Delta Airlines' customers. You are expected to design components for our webpage in ReactJS and the Ant-Design visual framework."
rUtreAvx8vpzJlOgWPq8,Jet Blue,5600,E-commerce and Booking Platform Upgrade Project,5/7/2023,1/28/2024,"WebDev, Ecommerce, SoftwareDevelopment, EcommerceUpgrade, UserFriendlyExperience","E-commerce and Booking Platform Upgrade Project (Jet Blue): Jet Blue is seeking candidates with experience in e-commerce platforms, booking systems, and software development. The project involves upgrading the e-commerce and booking platform, implementing new features, and ensuring a streamlined and user-friendly booking experience for Jet Blue customers. We are looking for a background in operations research and hands-on coding experience."
9l5F8RA68fZKkMijMG7k,Southwest Airlines,4800,Sustainable Aviation and Fuel Efficiency Project,9/1/2023,1/30/2024,"Philanthropy, Software, DevOps, GreenEnergyIntegration, EnvironmentalResponsibility","Sustainable Aviation and Fuel Efficiency Project (Southwest Airlines): Southwest Airlines is looking for candidates with expertise in sustainable aviation and fuel efficiency. The project involves writing proposals in conjunction with local preservation initiatives to enhance sustainability, optimize fuel efficiency, and contribute to Southwest Airlines' commitment to environmental responsibility."
UomtM1n2RFHJONdB7j7g,AT&T,8800,Telecommunications Network Infrastructure Upgrade Project,2/24/2023,3/26/2023,"Networking, Software, SystemUpgrades, Telecommunications, Connectivity","Telecommunications Network Infrastructure Upgrade Project (AT&T): AT&T is seeking candidates with skills in telecommunications, network infrastructure, and system upgrades. The project focuses on upgrading and optimizing the telecommunications network infrastructure, ensuring reliability in our computer systems, and meeting the evolving demands of AT&T's customers."
tikJii6NavGxuAF3OPQp,Verizon,7200,5G Network Expansion and Optimization Project,8/26/2023,4/25/2024,"Networking, Software, DevOps, 5GNetwork, OptimizationStrategies","5G Network Expansion and Optimization Project (Verizon): Verizon is looking for candidates with experience in 5G network technologies, telecommunications, and optimization strategies. The project involves researching new locations for optimizing the 5G network, ensuring high-performance connectivity by working closely with customer support teams."
F9zmxij0hPfkxyjSFsFL,T-Mobile,4000,Mobile App User Interface Redesign Project,12/2/2023,7/9/2024,"Mobile, UIUX, Frontend, UIRedesign, VisualAppeal","Mobile App User Interface Redesign Project (T-Mobile): T-Mobile is seeking candidates with expertise in mobile app design, UX/UI, and user interface redesign. The project entails redesigning the user interface of mobile applications, optimizing user experiences, and ensuring a visually appealing and intuitive design for T-Mobile's customers. You will also respond to customer support teams directly to implement immediate changes to the codebase."
wyTFLyWdfMJqag3zBJGK,Bath & Body Works Inc,5600,E-commerce Platform Enhancement Project,3/4/2024,8/6/2024,"WebDev, Ecommerce, Software, EcommerceEnhancement, DesignImprovements","E-commerce Platform Enhancement Project (Bath & Body Works Inc): Bath & Body Works Inc is looking for candidates with expertise in e-commerce platforms, retail analytics, and customer experience. You will be tasked with analyzing website analytics through GoogleAnalytics and Tableau."
LBXn0G7gsIjqLxag9iWP,Berkshire Hathaway,3200,Investment Portfolio Analysis and Optimization Initiative,8/26/2023,10/15/2024,"Software, Consulting, Finance, StrategicDecisions, FinancialOptimization","Investment Portfolio Analysis and Optimization Initiative (Berkshire Hathaway): Berkshire Hathaway is seeking candidates with a strong background in finance, investment analysis, and portfolio optimization. Successful candidates will be instrumental in conducting in-depth analysis of investment portfolios, identifying optimization opportunities, and contributing to strategic decisions that align with Berkshire Hathaway's investment goals within the initiative timeline."
hV3mBC0Riz9GhudfoEej,CarMax,8000,Online Car Buying Experience Improvement Project,5/12/2024,6/23/2024,"UIUX, Frontend, UXDesign, OnlineRetail, CustomerExperience","Online Car Buying Experience Improvement Project (CarMax): CarMax is looking for candidates with expertise in UX/UI design, online retail, and customer experience. The project involves enhancing the online car buying experience, implementing and proposing design improvements for the web and mobile application."
qQwixFFsYkeTsNraTEVb,Toyota,8000,Sustainable Mobility Solutions Innovation Challenge,7/25/2023,9/24/2024,"Philanthropy, Software, Innovation, SustainableTransportation, EnvironmentalFriendly","Sustainable Mobility Solutions Innovation Challenge (Toyota): Toyota is seeking candidates with a passion for sustainability, innovation, and expertise in sustainable mobility solutions. The challenge invites individuals to propose innovative ideas for sustainable transportation, contributing to Toyota's commitment to advancing environmentally friendly mobility solutions. You will be tasked with writing a report on avenues of sustainability and public response."
QDmwluHFI2v0uVe4pi9e,Dell Technologies,2400,IT Infrastructure Modernization and Security Project,2/21/2024,4/15/2024,"Software, Networking, Security, DevOps, ModernizationStrategies","IT Infrastructure Modernization and Security Project (Dell Technologies): Dell Technologies is looking for candidates with skills in IT infrastructure, cybersecurity, and modernization strategies. The project involves modernizing IT infrastructure to current standards and migrating codebases from C to C++."
rH4yYujQ4FylV1aCh78O,Ford Motor Company,2400,Electric Vehicle Technology Development Initiative,1/28/2024,3/31/2024,"Software, DevOps, ElectricVehicleTechnology, Innovation, TechnologyDevelopment","Electric Vehicle Technology Development Initiative (Ford Motor Company): Ford Motor Company is seeking candidates with expertise in electric vehicle technology, automotive engineering, and innovation. The initiative focuses on developing advanced electric vehicle motors, more specifically, through 3D CAD models and virtual tests."
gHuzZw8UWTHcoqaOKmT2,Fox Corporation,4800,Digital Media Content Creation and Distribution Project,5/9/2024,10/30/2024,"Software, Advertising, UIUX, ContentCreation, DistributionStrategies","Digital Media Content Creation and Distribution Project (Fox Corporation): Fox Corporation is looking for candidates with skills in digital media, content creation, and distribution strategies. The project involves creating and distributing digital media content for platforms like Instagram/Facebook/TikTok while maintaining a reputation for the FOX brand."
byhOm7ERxIFVxLuHRjTc,Intel,3200,Advanced Processor Architecture Research and Development Project,5/23/2024,7/28/2024,"Software, DevOps, ComputerArchitecture, ResearchDevelopment, ProcessorArchitecture","Advanced Processor Architecture Research and Development Project (Intel): Intel is seeking candidates with a background in computer architecture, processor design, and research and development to thoroughly test advanced processor architectures while optimizing performance with engineering teams."
4lwkHyqy7A4z6B9X9cEX,Lowe's,1600,Customer Data Analytics for Personalized Shopping Experience Project,9/27/2023,10/10/2024,"Software, Networking, Security, DevOps, CustomerDataAnalytics","Customer Data Analytics for Personalized Shopping Experience Project (Lowe's): Lowe's is looking for candidates with expertise in customer data analytics, retail analytics, and personalized shopping experiences. You will play a key role in analyzing customer data with machine learning analytics, running simulations, and proposing strategies to enhance the personalized shopping experience for Lowe's customers."
WR6gSFUNZdb7ep514rpz,Costco,6400,Marketing Strategy Optimization for Membership Engagement Project,6/20/2024,7/20/2024,"Marketing, DataAnalysis, MembershipPrograms, MarketingOptimization, MembershipEngagement","Marketing Strategy Optimization for Membership Engagement Project (Costco): Costco is seeking candidates with skills in marketing strategy, membership engagement, and data analytics. The project involves optimizing marketing strategies to enhance membership engagement through data analysis with Excel and PowerBI. You will conduct a formal review on Costco's current methods with the marketing and PR team."
ne7GCO6l1pRuEp85498g,PepsiCo,6400,Data-Driven Product Innovation and Market Expansion Initiative,7/23/2023,12/13/2023,"DataAnalysis, DataDrivenInnovation, MarketExpansion, ConsumerInsights, ProductInnovation","Data-Driven Product Innovation and Market Expansion Initiative (PepsiCo): PepsiCo is looking for candidates with expertise in data-driven product innovation, market expansion, and consumer insights. You will conduct industry research on new and innovative products, and communicate with product development teams on your findings."
AyqftAgrhzPGi2PXLcqs,Coca Cola,3200,Market Segmentation and Brand Positioning Analysis Project,8/27/2023,1/23/2024,"Marketing, MarketSegmentation, BrandPositioning, MarketAnalysis, StrategicDecisions","Market Segmentation and Brand Positioning Analysis Project (Coca Cola): Coca Cola is seeking candidates with skills in market segmentation, brand positioning, and market analysis. The project involves conducting in-depth market segmentation analysis by collecting data from buyers and sellers. You will present a final timeline on how Coca Cola will improve its market performance over time."
VLHdq8CxkqLboWvLbHfB,Proctor & Gamble,1600,Consumer Behavior Analysis and Product Portfolio Optimization Project,10/21/2023,6/18/2024,"DataAnalysis, ConsumerBehaviorAnalysis, PortfolioOptimization, MarketResearch, StrategicDecisions","Consumer Behavior Analysis and Product Portfolio Optimization Project (Proctor & Gamble): Proctor & Gamble is looking for candidates with expertise in consumer behavior analysis, product portfolio optimization, and market research. The project involves analyzing consumer behavior, optimizing product portfolio with optimization software, and presenting your findings to enhance Proctor & Gamble's market presence."
k28azTriTrst84SL04F4,Pfizer,9600,Pharmaceutical Market Trends Analysis and Forecasting Project,6/18/2023,12/7/2024,"Pharmaceuticals, DataAnalysis, MarketAnalysis, Forecasting, and Research","Pharmaceutical Market Trends Analysis and Forecasting Project (Pfizer): Pfizer is seeking candidates with a background in pharmaceuticals, market analysis, and forecasting. You will research market trends for pharmaceutical goods, forecasting pharmaceutical demand using probablistic and time-series methods, and contributing to Pfizer's strategic decisions by conducting thorough literature reviews within the pharmaceutical market."
4tZpKNEiFFkh0BaVj1Hs,Moderna,4000,Biotech Product Launch Strategy and Market Penetration Project,5/4/2024,11/7/2024,"Biopharmaceuticals, Strategy, Biotech, MarketPenetration, and Marketing","Biotech Product Launch Strategy and Market Penetration Project (Moderna): Moderna is looking for candidates with expertise in biotech product launches, market penetration strategies, and biopharmaceuticals. You will begin by investigating product launch strategies through public relations and media representation, then you will learn about consumer repsonse through surveying and other data collection methods, and presenting to company representatives as a conclusion to the project."
